{
    "document_metadata": {
      "document_type": "sale_deed",
      "certificate_number": "IN-DL61365966288224T",
      "execution_date": "2021-12-17",
      "registration_date": "2021-12-25",
      "registration_number": "18246",
      "registration_book": "1",
      "registration_volume": "10370",
      "stamp_duty_paid": 45000,
      "registration_fee": 11250,
      "document_hash": "SUBIN-DLOL-SHCIL14740498291127T"
    },
    "property_details": {
      "property_id": "V-686",
      "property_address": "V-686, Rishi Nagar, Shakur Basti, Delhi-34",
      "locality": "RISHI NAGAR",
      "area_sq_meters": 50.18,
      "floor": "Third Floor",
      "property_type": "Built-up Residential",
      "construction_year": "after 2000",
      "old_numbers": ["2263", "WZ-279", "380"],
      "khasra_number": "369",
      "village": "SALEEMPUR MAZRA MADIPUR",
      "land_share": "1/4 share in land",
      "total_land_area": "125 sq.yds",
      "built_land_area": "60 sq.yds"
    },
    "transaction_details": {
      "transaction_amount": 1125000,
      "transaction_currency": "INR",
      "payment_method": [
        {
          "amount": 562500,
          "method": "RTGS",
          "utr_number": "CNRBR52021111571700740",
          "date": "2021-11-15",
          "bank": "Canara Bank, Rani Bagh"
        },
        {
          "amount": 562500,
          "method": "RTGS", 
          "utr_number": "CNRBR52021111571700879",
          "date": "2021-11-15",
          "bank": "Canara Bank, Rani Bagh"
        }
      ],
      "circle_rate_per_sqm": 56064,
      "construction_rate_per_sqm": 7488,
      "calculated_land_cost": 703322,
      "calculated_construction_cost": 375747,
      "total_calculated_cost": 1079070
    },
    "parties": {
      "sellers": [
        {
          "name": "ANJU KHURANA",
          "share": "50%",
          "spouse": "Madan Gopal Khurana",
          "address": "1847, Rani Bagh, Shakur Basti, Delhi-110034"
        },
        {
          "name": "ANJANA GULATI", 
          "share": "50%",
          "spouse": "Kuldeep Gulati",
          "address": "24, First Floor, Shakti Vihar, Delhi-110034"
        }
      ],
      "buyer": {
        "name": "MANJULA",
        "spouse": "Singha Ram",
        "address": "473, E-Block, Shakur Pur J.J. Colony, Delhi-110034",
        "mobile": "9718695530",
        "electricity_ca": "200045642644"
      }
    },
    "ownership_history": {
      "previous_transaction": {
        "date": "2018-06-15",
        "sellers": ["YASH PAUL BATRA", "INDER PAUL BATRA", "DHARAM PAUL BATRA", "MITTER PAUL BATRA"],
        "deed_number": "8636",
        "registration_office": "Sub-Registrar-VI-A, Pitampura"
      }
    }
}
